{
  "report_id": "report-record-cn-example-001",
  "project_id": "project-cn-example-001",
  "brief_path": "reports/project-cn-example-001/brief.md",
  "evidence_pack_path": "reports/project-cn-example-001/evidence-pack.zip",
  "objection_draft_path": "reports/project-cn-example-001/objection-draft.md",
  "review_request_list_path": "reports/project-cn-example-001/review-requests.json",
  "review_task_status": "PENDING_REVIEW",
  "report_status": "READY",
  "written_back_at": "2026-04-04T18:10:00+08:00"
}
