{
  "report_id": "report-review-001",
  "project_id": "project-cn-review-001",
  "brief_path": "reports/review-ready/brief.md",
  "evidence_pack_path": "reports/review-ready/evidence-pack.zip",
  "objection_draft_path": "reports/review-ready/objection-draft.md",
  "review_request_list_path": "reports/review-ready/review-requests.json",
  "review_task_status": "PENDING_REVIEW",
  "report_status": "READY",
  "written_back_at": "2026-04-04T18:10:00+08:00"
}
